{
  "created_at": "2026-01-17T08:00:09Z",
  "decision_hash": "sha256:db7345a48b892bfe465d58fbe97f4257c7686e3ef8e76cc025296281ae1b9820",
  "message_id": "83a065a2-733b-5960-b63d-0d3360f5923e",
  "run_id": "4259d70a-ff16-54a2-8532-18cb4c62b03f",
  "schema_id": "urn:ieim:schema:identity-resolution-result:1.0.0",
  "schema_version": "1.0.0",
  "selected_candidate": null,
  "status": "IDENTITY_NO_CANDIDATE",
  "thresholds": {
    "confirmed_min_margin": 0.2,
    "confirmed_min_score": 0.9,
    "probable_min_margin": 0.12,
    "probable_min_score": 0.75
  },
  "top_k": []
}
