{
  "created_at": "2026-01-17T08:00:07Z",
  "decision_hash": "sha256:5247470b2bf99bf03bcb16fee1f2a4158e069e54089c1ed1ab97347e4f62c071",
  "message_id": "101f1b6d-ea7b-54b4-833d-53e11c190174",
  "run_id": "3b9d2692-3165-53cf-aeca-fa26ab75a4d9",
  "schema_id": "urn:ieim:schema:identity-resolution-result:1.0.0",
  "schema_version": "1.0.0",
  "selected_candidate": null,
  "status": "IDENTITY_NO_CANDIDATE",
  "thresholds": {
    "confirmed_min_margin": 0.15,
    "confirmed_min_score": 0.85,
    "probable_min_margin": 0.1,
    "probable_min_score": 0.7
  },
  "top_k": []
}
