{
  "created_at": "2026-01-17T08:00:02Z",
  "decision_hash": "sha256:bf19f28710bcabe6d901805d77ccbcd601e2424ed8ee51bf060ed9e61980ad3f",
  "message_id": "e43d7757-c717-5ca0-b306-c1ece970fc3b",
  "run_id": "08646473-3683-51d5-9df9-2d40c4dd227d",
  "schema_id": "urn:ieim:schema:identity-resolution-result:1.0.0",
  "schema_version": "1.0.0",
  "selected_candidate": {
    "entity_id": "CLM-2025-9911",
    "entity_type": "CLAIM",
    "evidence": [
      {
        "end": 38,
        "snippet_redacted": "clm-2025-9911",
        "snippet_sha256": "sha256:3b6a9e6e4a80fe6de1148cfce7a4fd5bbca97c9bbb0b64b7ebf02314cd192dbf",
        "source": "SUBJECT_C14N",
        "start": 25
      }
    ],
    "rank": 1,
    "score": 0.92,
    "signals": [
      {
        "name": "SIG_CLAIM_NUMBER_LOOKUP_MATCH",
        "strength": 1.0,
        "value": "CLM-2025-9911",
        "weight": 0.8
      }
    ]
  },
  "status": "IDENTITY_CONFIRMED",
  "thresholds": {
    "confirmed_min_margin": 0.2,
    "confirmed_min_score": 0.9,
    "probable_min_margin": 0.12,
    "probable_min_score": 0.75
  },
  "top_k": [
    {
      "entity_id": "CLM-2025-9911",
      "entity_type": "CLAIM",
      "evidence": [
        {
          "end": 38,
          "snippet_redacted": "clm-2025-9911",
          "snippet_sha256": "sha256:3b6a9e6e4a80fe6de1148cfce7a4fd5bbca97c9bbb0b64b7ebf02314cd192dbf",
          "source": "SUBJECT_C14N",
          "start": 25
        }
      ],
      "rank": 1,
      "score": 0.92,
      "signals": [
        {
          "name": "SIG_CLAIM_NUMBER_LOOKUP_MATCH",
          "strength": 1.0,
          "value": "CLM-2025-9911",
          "weight": 0.8
        }
      ]
    }
  ]
}
