{
  "created_at": "2026-01-17T08:00:06Z",
  "decision_hash": "sha256:5bd8f837884d01a90fe18575fc4a7c07144dc5a77894988fd8bcedd46592fc08",
  "message_id": "af708e2b-42d1-5b36-81b3-70f1aa978073",
  "run_id": "8e41f141-3b87-514a-bd65-c1e361ecff14",
  "schema_id": "urn:ieim:schema:identity-resolution-result:1.0.0",
  "schema_version": "1.0.0",
  "selected_candidate": {
    "entity_id": "POL-77-7654321",
    "entity_type": "POLICY",
    "evidence": [
      {
        "end": 114,
        "snippet_redacted": "polizzennr 77-7654321",
        "snippet_sha256": "sha256:1348edafd2902412733f5ed2cef5987b37aebbf3a579b3faa01430f5f9827841",
        "source": "BODY_C14N",
        "start": 93
      }
    ],
    "rank": 1,
    "score": 0.91,
    "signals": [
      {
        "name": "SIG_POLICY_NUMBER_LOOKUP_MATCH",
        "strength": 1.0,
        "value": "77-7654321",
        "weight": 0.75
      }
    ]
  },
  "status": "IDENTITY_CONFIRMED",
  "thresholds": {
    "confirmed_min_margin": 0.2,
    "confirmed_min_score": 0.9,
    "probable_min_margin": 0.12,
    "probable_min_score": 0.75
  },
  "top_k": [
    {
      "entity_id": "POL-77-7654321",
      "entity_type": "POLICY",
      "evidence": [
        {
          "end": 114,
          "snippet_redacted": "polizzennr 77-7654321",
          "snippet_sha256": "sha256:1348edafd2902412733f5ed2cef5987b37aebbf3a579b3faa01430f5f9827841",
          "source": "BODY_C14N",
          "start": 93
        }
      ],
      "rank": 1,
      "score": 0.91,
      "signals": [
        {
          "name": "SIG_POLICY_NUMBER_LOOKUP_MATCH",
          "strength": 1.0,
          "value": "77-7654321",
          "weight": 0.75
        }
      ]
    }
  ]
}
