{
  "created_at": "2026-01-17T08:00:04Z",
  "decision_hash": "sha256:4059ac52140ee56f117b73d39b712d12df6b7ead59a3dc180bc4f28cc459ea66",
  "message_id": "665506c4-f415-53b2-bfd9-4a70f9534900",
  "run_id": "0ea43aa6-c5bf-5746-9ef0-46404e99ee5d",
  "schema_id": "urn:ieim:schema:identity-resolution-result:1.0.0",
  "schema_version": "1.0.0",
  "selected_candidate": null,
  "status": "IDENTITY_NEEDS_REVIEW",
  "thresholds": {
    "confirmed_min_margin": 0.2,
    "confirmed_min_score": 0.9,
    "probable_min_margin": 0.12,
    "probable_min_score": 0.75
  },
  "top_k": []
}
