{
  "created_at": "2026-01-17T08:00:08Z",
  "decision_hash": "sha256:5756fbbf4969c09f0b6213cb1406ae6e2d88b358aad23c02b86e6a1a466e980e",
  "message_id": "7fe5dd82-0527-5644-ac06-937c6f22562e",
  "run_id": "109101f4-75aa-5383-9cc1-6424260a79a8",
  "schema_id": "urn:ieim:schema:identity-resolution-result:1.0.0",
  "schema_version": "1.0.0",
  "selected_candidate": null,
  "status": "IDENTITY_NO_CANDIDATE",
  "thresholds": {
    "confirmed_min_margin": 0.2,
    "confirmed_min_score": 0.9,
    "probable_min_margin": 0.12,
    "probable_min_score": 0.75
  },
  "top_k": []
}
