{
  "created_at": "2026-01-17T08:00:03Z",
  "decision_hash": "sha256:b58bdf4f98e6a212774fab7fe47390e7d5c104f58370d8e69bf4d1a03ebca9f5",
  "message_id": "67205626-a488-5439-9e1f-7c9717ee5e3b",
  "run_id": "28cc5831-a6b7-5ee3-9cb4-a47d97674179",
  "schema_id": "urn:ieim:schema:identity-resolution-result:1.0.0",
  "schema_version": "1.0.0",
  "selected_candidate": null,
  "status": "IDENTITY_NO_CANDIDATE",
  "thresholds": {
    "confirmed_min_margin": 0.2,
    "confirmed_min_score": 0.9,
    "probable_min_margin": 0.12,
    "probable_min_score": 0.75
  },
  "top_k": []
}
