{
  "created_at": "2026-01-17T08:00:10Z",
  "decision_hash": "sha256:347759fdb9c4a5efb77aa6733177b67469599440d50e945cb09b7703cd46ad75",
  "message_id": "b81451c0-5745-5dba-9d44-6b7e245335ff",
  "run_id": "a1a18978-18ed-50a2-8909-e2e9cb6b78a6",
  "schema_id": "urn:ieim:schema:identity-resolution-result:1.0.0",
  "schema_version": "1.0.0",
  "selected_candidate": null,
  "status": "IDENTITY_NO_CANDIDATE",
  "thresholds": {
    "confirmed_min_margin": 0.15,
    "confirmed_min_score": 0.85,
    "probable_min_margin": 0.1,
    "probable_min_score": 0.7
  },
  "top_k": []
}
